<!DOCTYPE konyvek [
<!ELEMENT konyvek (konyv+)>
<!ELEMENT konyv (cim,kiadasi_eve,kiado,szerzo)>
<!ELEMENT cim (#PCDATA)>
<!ELEMENT kiadasi_eve (#PCDATA)>
<!ELEMENT kiado (#PCDATA)>
<!ELEMENT szerzo (#PCDATA)>
]>
